{"status":"complete","package_path":"output/skills/toolboxmd-use-grok","tests":[{"command":"python3 harness/isolation_preflight.py model","outcome":"passed"},{"command":"Creator validator with all frozen budgets and syntax attestation","outcome":"passed with 0 errors and 0 warnings; exactly 2 files, 0 symlinks, 17,739 package bytes"},{"command":"harness/fake_grok.py explicit review rehearsals","outcome":"passed streaming, direct, and envelope output shapes; prompt-file transport and shell-injection resistance passed"},{"command":"harness/fake_grok.py failure rehearsals","outcome":"passed missing-cli, isolation-failure, nonzero-exit, invalid-json, incomplete-stop-reason, max-turns, runtime tool-call denial, and parent timeout classifications"},{"command":"automatic mode rehearsal","outcome":"passed fail-closed with isolation-failure and no Grok invocation"}],"notes":["Automatic mode remains disabled pending real acceptance of a stable dedicated authenticated profile.","No real Grok CLI, model, agent, network service, or synthetic real consultation was called.","The sandbox denied the fake harness from spawning its grandchild, so complete child-tree termination could not be observed locally; parent timeout and process-group termination logic were exercised."]}