{"status":"complete","package_path":"output/skills/toolboxmd-use-grok","tests":[{"command":"python3 harness/isolation_preflight.py model","outcome":"passed"},{"command":"temporary minimal acceptance cases","outcome":"credential rejection, numeric bounds, output shapes, safe prompt/argv/environment, and relevant failure classifications passed"},{"command":"python3 -B -c 'import ast, pathlib; ast.parse(pathlib.Path(\"output/skills/toolboxmd-use-grok/scripts/consult-grok\").read_text())'","outcome":"passed"},{"command":"validate_skill.py --creation-mode --warnings-as-errors --script-syntax-checked ... output/skills/toolboxmd-use-grok","outcome":"passed; exactly 2 files, 1 script, 15401 package bytes"}],"notes":["Resolved: credential-shaped input is rejected before CLI invocation; finite lower and upper bounds are enforced before invocation.","Unresolved feedback: the reported direct/envelope/streaming and argv-contract failures were not reproducible from the visible contract and supplied fake; all corresponding local acceptance cases pass, so no unsupported changes were made.","Exactly one final package remains under output/skills/, containing only SKILL.md and scripts/consult-grok."]}