{"status":"complete","package_path":"output/skills/toolboxmd-use-grok/","tests":[{"command":"python3 harness/isolation_preflight.py model","outcome":"Passed."},{"command":"Creator validator with all frozen contract budgets and warnings as errors","outcome":"Passed: 2 files, 0 symlinks, 62 SKILL.md lines, 4,882 SKILL.md bytes, 20,031 package bytes."},{"command":"Fake Grok success and failure scenario matrix","outcome":"Passed direct, envelope, and streaming success; correctly classified all required failure categories and rejected tool calls and unsafe inspection."},{"command":"Automatic-mode rehearsal","outcome":"Passed: failed closed without launching Grok."},{"command":"Timeout and process-tree rehearsal","outcome":"Passed: returned timeout and terminated the child process."},{"command":"Shell-injection rehearsal","outcome":"Passed: prompt metacharacters remained data and created no marker."},{"command":"Final syntax, executable-mode, structure, and streaming smoke checks","outcome":"Passed."}],"notes":["No real Grok CLI, model, agent, or network service was called.","Automatic mode remains disabled because no stable dedicated authenticated profile has passed real acceptance.","The optional official skills-ref validator was unavailable; the sole Creator skill's canonical validator passed."]}