{"status":"complete","package_path":"output/skills/toolboxmd-use-grok","tests":[{"command":"python3 harness/isolation_preflight.py model","outcome":"Passed."},{"command":"PYTHONDONTWRITEBYTECODE=1 python3 -B output/rehearsal/run_tests.py","outcome":"Passed 14 deterministic scenarios covering successful output shapes, contract failure categories, timeout process-tree termination, automatic fail-closed behavior, and shell-injection resistance."},{"command":"PYTHONDONTWRITEBYTECODE=1 python3 -B home/.codex/skills/creator-under-test/scripts/validate_skill.py output/skills/toolboxmd-use-grok --json --warnings-as-errors --max-description-chars 400 --max-skill-lines 150 --max-skill-bytes 10500 --max-files 2 --max-package-bytes 45000 --max-reference-files 0 --max-eval-files 0 --max-script-files 1","outcome":"Passed with zero errors or warnings: exactly 2 files, 0 references/evals, 1 script, 362-character description, 48-line/4,088-byte SKILL.md, and 20,691-byte package."},{"command":"find output/skills/toolboxmd-use-grok -type l -print; find output/skills/toolboxmd-use-grok -type f -print; test -x output/skills/toolboxmd-use-grok/scripts/consult-grok","outcome":"Zero symlinks; exact required two-file tree; adapter is executable."}],"notes":["No real Grok CLI, model, agent, or network service was called.","Automatic mode remains disabled and returns isolation-failure until a stable dedicated authenticated profile passes real acceptance.","Explicit mode was rehearsed only against the deterministic fake CLI; real CLI acceptance remains outstanding."]}