{"status":"complete","package_path":"output/skills/toolboxmd-use-grok","tests":[{"command":"python3 harness/isolation_preflight.py model","outcome":"Passed: true."},{"command":"PYTHONDONTWRITEBYTECODE=1 python3 -B home/.codex/skills/creator-under-test/scripts/validate_skill.py --creation-mode --warnings-as-errors --script-syntax-checked 'scripts/consult-grok=39a3ab366117000bbbf1e442123b1731916cbea8a42960c3b043ce6128e995a6' output/skills/toolboxmd-use-grok","outcome":"Passed. Exactly 2 files; description 352 characters; SKILL.md 50 lines and 3,991 bytes; package 18,802 bytes; zero references and evals."},{"command":"python3 -B -c 'import ast, pathlib; ast.parse(pathlib.Path(\"output/skills/toolboxmd-use-grok/scripts/consult-grok\").read_text(encoding=\"utf-8\"))'","outcome":"Passed Python syntax validation."},{"command":"consult-grok explicit rehearsals with isolated copies of harness/fake_grok.py","outcome":"Streaming, direct, and envelope success shapes returned status ok. Invalid JSON, bad isolation, runtime tool use, incomplete stop, max turns, nonzero exit, missing CLI, and timeout returned their concrete categories."},{"command":"consult-grok automatic and shell-metacharacter rehearsals","outcome":"Automatic mode failed closed without consultation; prompt filename metacharacters were passed safely without shell execution; timeout terminated the spawned process tree."},{"command":"find output/skills/toolboxmd-use-grok -type f -o -type l","outcome":"Found exactly SKILL.md and executable scripts/consult-grok; no symlinks."}],"notes":["Automatic mode remains disabled until a stable dedicated authenticated GROK_HOME passes real isolation acceptance.","No real Grok CLI, model, agent, network service, or real authenticated acceptance was invoked.","Temporary rehearsal artifacts were removed after validation."]}