{"status":"complete","package_path":"output/skills/toolboxmd-use-grok","tests":[{"command":"python3 harness/isolation_preflight.py model","outcome":"passed"},{"command":"python3 -B output/rehearsal/run_tests.py","outcome":"passed all output shapes and contracted failures; verified automatic fail-closed behavior, shell-injection resistance, context exclusion, and child-tree timeout termination"},{"command":"python3 -B -c 'import ast, pathlib; ast.parse(pathlib.Path(\"output/skills/toolboxmd-use-grok/scripts/consult-grok\").read_text(encoding=\"utf-8\"))'","outcome":"passed"},{"command":"PYTHONDONTWRITEBYTECODE=1 python3 -B home/.codex/skills/creator-under-test/scripts/validate_skill.py --creation-mode --warnings-as-errors --script-syntax-checked 'scripts/consult-grok=1efb1978ad23118fcd97a2b1aba89eb744f734ffac12f2ecaa14ae881cc03a8a' --max-description-chars 400 --max-skill-lines 150 --max-skill-bytes 10500 --max-files 2 --max-package-bytes 45000 --max-reference-files 0 --max-eval-files 0 --max-script-files 1 output/skills/toolboxmd-use-grok","outcome":"passed: 316 description characters, 56 SKILL.md lines, 4,007 SKILL.md bytes, 2 files, 18,299 package bytes"},{"command":"find/stat exact structure, symlink, and executable checks","outcome":"passed: exactly two regular files, no symlinks, consult-grok executable"}],"notes":["Automatic mode remains disabled pending real acceptance of a stable dedicated authenticated profile.","No real Grok CLI, model, agent, network service, or real credential was used.","Effective-configuration acceptance is intentionally pinned to the frozen Grok 1.0.3 allow-list."]}