{"status":"complete","package_path":"output/skills/toolboxmd-use-grok","tests":[{"command":"python3 harness/isolation_preflight.py model","outcome":"Passed."},{"command":"Creator validator with creation mode, warnings-as-errors, exact script digest, and all contract budgets","outcome":"Passed: 2 files, 18,101 bytes, SKILL.md 48 lines/3,906 bytes, description 360 characters, zero references/evals."},{"command":"Scenario-driven rehearsal using harness/fake_grok.py","outcome":"Passed direct, envelope, streaming, isolation failures, runtime tool-call rejection, incomplete stop, nonzero exit, max-turns, invalid JSON, timeout with child-tree termination, missing CLI, injection resistance, and disabled automatic mode."},{"command":"Final regular-file, symlink, executable-bit, and byte-count inspection","outcome":"Passed: exactly two regular files, no symlinks, executable adapter."}],"notes":["Automatic mode remains fail-closed until a stable dedicated authenticated profile passes real acceptance.","No real Grok CLI, model, agent, or network service was invoked.","The optional official skills-ref validator was unavailable; the supplied Creator validator passed."]}