{"status":"complete","package_path":"/private/tmp/creator-refinement-adfe9495-6565-4c1c-9cb6-55bdd178a4b7/sandbox/output/skills/safe-archive-inspector","tests":[{"command":"python3 harness/isolation_preflight.py model","outcome":"passed"},{"command":"PYTHONDONTWRITEBYTECODE=1 python3 -B output/acceptance/test_inspector.py","outcome":"passed representative safe/unsafe TAR and ZIP cases, encrypted ZIP metadata, malformed input, mutation checks, and payload-access guards"},{"command":"Python AST parse with feature_version=(3, 9), followed by current-runtime compile","outcome":"passed"},{"command":"Creator validator with creation mode, warnings as errors, and all explicit contract budgets","outcome":"passed: 2 files, 8422 package bytes, 69 SKILL.md lines"},{"command":"Executable helper invoked from a different cwd against a non-archive input","outcome":"passed: exit 2, one compact error JSON object, empty stderr"}],"notes":["Helper is executable, standard-library-only, and cwd-independent.","The sandbox's system Python launcher was unavailable; Python 3.9 compatibility was verified using the current standard library's Python 3.9 grammar mode.","Canonical portable validation passed; the validator reported its optional external official validator as unavailable.","The distributed package contains only SKILL.md and scripts/inspect_archive.py."]}