{"status":"complete","package_path":"output/skills/toolboxmd-use-grok/","tests":[{"command":"python3 harness/isolation_preflight.py model","outcome":"Passed."},{"command":"Canonical ToolboxMD validator with frozen contract budgets and script SHA-256 attestation","outcome":"Passed: exactly 2 files, 14,446 package bytes, 351-character description, SKILL.md 64 lines/3,189 bytes, zero references/evals/symlinks."},{"command":"harness/fake_grok.py scenario matrix","outcome":"Passed streaming, direct, envelope, isolation rejection, runtime tool-call rejection, incomplete stop, max-turns, invalid JSON, nonzero exit, and timeout classification."},{"command":"Automatic mode, missing CLI, and shell-injection rehearsals","outcome":"Passed with fail-closed isolation-failure, missing-cli, and literal prompt handling."},{"command":"consult-grok --help and executable permission check","outcome":"Passed; stable operator interface present and adapter executable."}],"notes":["Automatic mode remains disabled pending real acceptance of a stable dedicated authenticated GROK_HOME profile.","The host sandbox prevented the frozen fake timeout scenario from spawning its child process; timeout handling was rehearsed with direct sleep, while process-group TERM/KILL escalation is implemented.","No real Grok CLI, model, agent, network service, or network resource was called."]}