{"status":"complete","package_path":"/private/tmp/creator-refinement-94f74afc-a7f5-4cfa-a09a-6f5201e8077d/sandbox/output/skills/toolboxmd-use-grok","tests":[{"command":"python3 harness/isolation_preflight.py model","outcome":"passed"},{"command":"targeted fake acceptance cases","outcome":"passed: direct, envelope, streaming, safe argv/prompt/environment, and numeric bounds"},{"command":"broader fake failure matrix","outcome":"passed all executable non-timeout scenarios"},{"command":"Creator validator with syntax attestation and contract budgets","outcome":"passed"},{"command":"final package inventory","outcome":"passed: exactly one package containing exactly two required files"}],"notes":["Unresolved feedback: none.","The synthetic timeout child-tree fixture was skipped because the managed sandbox denied its child process spawn.","No network, real Grok, Git, credentials, agents, or agentic CLIs were used."]}