{"status":"complete","package_path":"output/skills/toolboxmd-use-grok","tests":[{"command":"python3 harness/isolation_preflight.py model","outcome":"passed"},{"command":"python3 output/repair-work/acceptance.py","outcome":"all visible-contract acceptance cases passed"},{"command":"Creator validator with Python AST check and SHA-256 attestation","outcome":"passed; 2 files, 18,324 bytes"}],"notes":["Repaired result-error classification, credential-shaped prompt rejection before invocation, and non-finite timeout rejection.","Unresolved feedback discrepancies: direct-envelope-streaming-success already passed on the raw candidate; safe-argv-prompt-and-environment passes the visible contract, while the feedback exposes no alternative argv requirement.","Exactly one final two-file package remains under output/skills/. The raw candidate was preserved outside the distributed package.","Real Grok acceptance was not attempted because network and agentic CLI use were prohibited."]}