{"status":"complete","package_path":"output/skills/toolboxmd-use-grok","tests":[{"command":"python3 harness/isolation_preflight.py model","outcome":"passed"},{"command":"python3 -m py_compile output/skills/toolboxmd-use-grok/scripts/consult-grok","outcome":"passed"},{"command":"harness/fake_grok.py rehearsal matrix","outcome":"passed direct, envelope, streaming, isolation, invalid JSON, incomplete, nonzero, max-turns, tool-call, timeout, process-tree, and injection scenarios"},{"command":"stdlib contract and budget validation","outcome":"passed: exactly 2 files, no symlinks, executable adapter, 30 SKILL.md lines, 3,171 SKILL.md bytes, 350-character description, 16,269 package bytes"},{"command":"python3 home/.codex/skills/creator-under-test/scripts/quick_validate.py output/skills/toolboxmd-use-grok","outcome":"validator unavailable because its PyYAML dependency is not installed; equivalent structural checks passed independently"},{"command":"final package cleanliness check","outcome":"passed; only SKILL.md and scripts/consult-grok remain"}],"notes":["Automatic mode remains disabled and fails closed pending acceptance of a stable dedicated authenticated profile.","No real Grok CLI, model, agent, or network service was called.","Temporary rehearsal artifacts and evidence were removed after validation."]}